"subject_str","subject_id","subject_type","predicate_org","predicate","object_str","object_id","object_type","text"
"einstein","http://www.wikidata.org/entity/Q937","Person","started teaching","start teach","himself calculus at 12","himself calculus at 12","Unknown","Einstein started teaching himself calculus at 12 , and as a 14-year-old he says he had `` mastered integral and differential calculus '' ."
"einstein","http://www.wikidata.org/entity/Q937","Person","supported","support","the Allies","the Allies","Unknown","Einstein supported the Allies but generally denounced the idea of nuclear weapons ."
"einstein","http://www.wikidata.org/entity/Q937","Person","giving","give","a treatment of the density variations in a fluid at its critical point","a treatment of the density variations in a fluid at its critical point","Unknown","Einstein returned to the problem of thermodynamic fluctuations , giving a treatment of the density variations in a fluid at its critical point ."
"einstein","http://www.wikidata.org/entity/Q937","Person","agreed","agree","to give Marić his future ( in the event","to give Marić his future ( in the event","Unknown","As part of the divorce settlement , Einstein agreed to give Marić his future ( in the event , 1921 ) Nobel Prize money ."
"einstein","http://www.wikidata.org/entity/Q937","Person","said","say","later","later","Unknown","As Einstein later said , the reason for the development of general relativity was that the preference of inertial motions within special relativity was unsatisfactory , while a theory which from the outset prefers no state of motion ( even accelerated ones ) should appear more satisfactory ."
"einstein","http://www.wikidata.org/entity/Q937","Person","was awarded","be award","a Federal teaching diploma In 1900","a Federal teaching diploma In 1900","Unknown","In 1900 , Einstein passed the exams in Maths and Physics and was awarded a Federal teaching diploma ."
"einstein","http://www.wikidata.org/entity/Q937","Person","was primarily affiliated","be primarily affiliate","with Ethical Culture groups in both the UK","with Ethical Culture groups in both the UK","Unknown","Einstein was primarily affiliated with non-religious humanist and Ethical Culture groups in both the UK and US ."
"einstein","http://www.wikidata.org/entity/Q937","Person","was","be","that so well known in America that he would be stopped on the street by people","that so well known in America that he would be stopped on the street by people","Unknown","In the period before World War II , `` The New Yorker '' published a vignette in their `` The Talk of the Town '' feature saying that Einstein was so well known in America that he would be stopped on the street by people wanting him to explain `` that theory '' ."
"einstein","http://www.wikidata.org/entity/Q937","Person","was called on","be call on","to give judgments on matters often unrelated to mathematics","to give judgments on matters often unrelated to mathematics","Unknown","Einstein offered and was called on to give judgments and opinions on matters often unrelated to theoretical physics or mathematics ."
"einstein","http://www.wikidata.org/entity/Q937","Person","published","publish","an article in `` Physikalische Zeitschrift the possibility of stimulated emission","an article in `` Physikalische Zeitschrift the possibility of stimulated emission","Unknown","In 1917 , at the height of his work on relativity , Einstein published an article in `` Physikalische Zeitschrift '' that proposed the possibility of stimulated emission , the physical process that makes possible the maser and the laser ."
"einstein","http://www.wikidata.org/entity/Q937","Person","predicted","predict","the phenomena of gravitational redshift In the same article","the phenomena of gravitational redshift In the same article","Unknown","In the same article , Einstein also predicted the phenomena of gravitational time dilation , gravitational redshift and deflection of light ."
"einstein","http://www.wikidata.org/entity/Q937","Person","published","publish","his own articles describing its implications","his own articles describing its implications","Unknown","Einstein also published his own articles describing the model and its implications , among them the Bose–Einstein condensate phenomenon that some particulates should appear at very low temperatures ."
"einstein","http://www.wikidata.org/entity/Q937","Person","felt","feel","that the waves of arriving Jews of the Aliyah could live alongside existing Arabs in Palestine","that the waves of arriving Jews of the Aliyah could live alongside existing Arabs in Palestine","Unknown","Einstein felt that the waves of arriving Jews of the Aliyah could live alongside existing Arabs in Palestine ."
"einstein","http://www.wikidata.org/entity/Q937","Person","replied","reply","No When asked if he believed in an afterlife","No When asked if he believed in an afterlife","Unknown","When asked if he believed in an afterlife , Einstein replied , `` No ."
"einstein","http://www.wikidata.org/entity/Q937","Person","married","marry","in January 1903","in January 1903","Unknown","Einstein and Marić married in January 1903 ."
"einstein","http://www.wikidata.org/entity/Q937","Person","bequeathed","bequeath","his personal library to the Hebrew University of Jerusalem in Israel","his personal library to the Hebrew University of Jerusalem in Israel","Unknown","Einstein bequeathed his personal archives , library and intellectual assets to the Hebrew University of Jerusalem in Israel ."
"einstein","http://www.wikidata.org/entity/Q937","Person","adopted","adopt","Minkowski 's formalism in his 1915 general theory of relativity","Minkowski 's formalism in his 1915 general theory of relativity","Unknown","Einstein adopted Minkowski 's formalism in his 1915 general theory of relativity ."
"einstein","http://www.wikidata.org/entity/Q937","Person","declined","decline","the invitation","the invitation","Unknown","Schrödinger urged Einstein to add his name as co-author , although Einstein declined the invitation ."
"einstein","http://www.wikidata.org/entity/Q937","Person","became","become","confused about the gauge invariance in the theory While developing general relativity","confused about the gauge invariance in the theory While developing general relativity","Unknown","While developing general relativity , Einstein became confused about the gauge invariance in the theory ."
"einstein","http://www.wikidata.org/entity/Q937","Person","noted","note","that science was often inclined to do more harm than good During an address to Caltech 's students","that science was often inclined to do more harm than good During an address to Caltech 's students","Unknown","During an address to Caltech 's students , Einstein noted that science was often inclined to do more harm than good ."
"einstein","http://www.wikidata.org/entity/Q937","Person","introduced","introduce","a new term , the cosmological constant , to the field equations , in order As observational evidence for a dynamic universe was not known at the time","a new term , the cosmological constant , to the field equations , in order As observational evidence for a dynamic universe was not known at the time","Unknown","As observational evidence for a dynamic universe was not known at the time , Einstein introduced a new term , the cosmological constant , to the field equations , in order to allow the theory to predict a static universe ."
"einstein","http://www.wikidata.org/entity/Q937","Person","became","become","an American citizen in 1940","an American citizen in 1940","Unknown","Einstein became an American citizen in 1940 ."
"einstein","http://www.wikidata.org/entity/Q937","Person","considered","consider","a steady-state model of the expanding universe many years before Bondi","a steady-state model of the expanding universe many years before Bondi","Unknown","It thus appears that Einstein considered a steady-state model of the expanding universe many years before Hoyle , Bondi and Gold ."
"einstein","http://www.wikidata.org/entity/Q937","Person","realized","realize","that the hole argument was mistaken After more than two years of intensive work","that the hole argument was mistaken After more than two years of intensive work","Unknown","After more than two years of intensive work , Einstein realized that the hole argument was mistaken and abandoned the theory in November 1915 ."
"einstein","http://www.wikidata.org/entity/Q937","Person","excelled at physics reaching ahead","excel at physic reach ahead","a mathematical level years of his peers","a mathematical level years of his peers","Unknown","Einstein excelled at math and physics from a young age , reaching a mathematical level years ahead of his peers ."
"einstein","http://www.wikidata.org/entity/Q937","Person","asked","ask","them to help bring Jewish scientists out of Germany","them to help bring Jewish scientists out of Germany","Unknown","Einstein asked them to help bring Jewish scientists out of Germany ."
"einstein","http://www.wikidata.org/entity/Q937","Person","agreed to give","agree to give","Marić his future ( in the event","Marić his future ( in the event","Unknown","As part of the divorce settlement , Einstein agreed to give Marić his future ( in the event , 1921 ) Nobel Prize money ."
"einstein","http://www.wikidata.org/entity/Q937","Person","was deeply impressed","be deeply impress","by Mahatma Gandhi","by Mahatma Gandhi","Unknown","Einstein was deeply impressed by Mahatma Gandhi , with whom he exchanged written letters ."
"einstein","http://www.wikidata.org/entity/Q937","Person","generally denounced","generally denounce","the idea of nuclear weapons","the idea of nuclear weapons","Unknown","Einstein supported the Allies but generally denounced the idea of nuclear weapons ."
"einstein","http://www.wikidata.org/entity/Q937","Person","contributed to these developments by linking","contribute to this development by link","them with the 1898 arguments","them with the 1898 arguments","Unknown","Einstein contributed to these developments by linking them with the 1898 arguments Wilhelm Wien had made ."
