document_id,subject_str,predicate_org,predicate,object_str,text
31468,his principles,of integrity is,of integrity be,his sweetness,"The spotless integrity of his principles , the equity and candour of his nature , his sweetness of temper , urbanity of manners and tenderness of heart , his benevolence and his piety are still dearer recollections of his family and friends ."
46279817,her research,was published in,be publish in,august 1957,"Her research was published in August 1957 , followed and confirmed by Hans Weil - Malherbe in November 1957 ."
67361767,variations,are found to,be find to,day,"To this day , variations of this algorithm are found in incremental version control systems , wiki engines , and molecular phylogenetics research software ."
155525,abbot,taken in,take in,prussia,"During the spring of the following year , in the course of the First Silesian War , the abbot , Antonin Nolbek , was arrested by the forces of the Kingdom of Prussia and taken to a prison in Prussia ."
13379670,hamilton,began,begin,writing about wyly in 1970s,Hamilton began writing about Wyly in software journals in the 1970s .
48886233,digital theories,expands,expand,century intercultural communication theories,"Shuter founded intercultural new media studies ( INMS ) , a communication sub-discipline which explores how new media technologies affect intercultural communication and “ investigates new digital theories of intercultural contact as well as refines and expands twentieth - century intercultural communication theories , examining their salience in a digital world . ”"
31267785,committee,confidence in,confidence in,presbytery,Indicating that the committee lacked confidence in the Western Presbytery with regard to this matter .
47972968,thawne,is,be,after killed by reality 's batman,"After Thawne is killed by this reality 's Batman with a sword stab through the chest , the Flash travels back in time to stop Barry 's younger self from altering history but instead , under Pandora 's manipulations , a third , new timeline is created , in which DC Comics ' continuity takes place from 2011 onward ."
62070,joliot curie,actively involved in,actively involve in,promoting women 's education serving on national committee,"Joliot - Curie became actively involved in promoting women 's education , serving on the National Committee of the Union of French Women ( "" Comité National de l'Union des Femmes Françaises "" ) and the World Peace Council ."
10315,deviations,are,be,made,"In a "" wide - band "" FM system , the deviations of the carrier frequency are made to be much larger in magnitude than the frequency of the audio signal ; this can be shown to provide better noise rejection ."
2995870,gp,is in,be in,norfolk,"Manson 's great - grandson Dr Gordon Manson - Bahr was a GP in Norfolk , UK for most of his medical career and his great - great grandson Dr David Manson - Bahr is a urologist in London ."
60539479,he,has,have,has researcher on chemistry of atmosphere with focus,"He has been a leading researcher on the chemistry of the atmosphere with special focus on stratospheric ozone depletion , climate change , and air quality ."
54865883,yaalon,received,receive,award of history of science society,"In 2000 , Yaalon received the Sarton Medal , the top award of the History of Science Society , from Ghent University in Belgium for outstanding contribution to the History of Soil Science ."
16559,phoenix force,seems in,seem in,certain incarnations acting as dark phoenix seemed,"The Phoenix Force also seems to render its host unaging and , at least in some adaptations , enhances the physical strength of its avatar to superhuman levels ; in certain incarnations , Jean , namely while acting as Dark Phoenix , seemed to possess some level of superhuman strength ."
14907770,walker,extended,extend,work,"Clynes and Walker extended this work in a research trip to central Australia , to the Yuendumu Reservation , to test if Aborigines would recognize emotions expressed by touch of white urban dwellers when transformed into sounds that conserved the dynamic shape of the touch ."
65844951,hung,has spoke in,have speak in,access to knowledge,"In addition to promoting greater access to scientific knowledge aside from her work in translation and education , Hung has also spoke at a numerous talks and lectures discussing her work ."
615022,40 domestic experiments,is in,be in,fluid dynamics,"He was also the mission scientist for Spacelab J ( STS - 47 ) coordinating more than 40 domestic and Japanese experiments in fluid dynamics , crystal growth , and life science during the 8 - day mission ."
21318911,papalexis,form,form,tremont foods to market,"Geisler and Papalexis partnered to form their own company , called Tremont Foods , to market and make the new red onion sauce ."
23829401,he,was drawn at,be draw at,yale,"While at Yale , he was drawn to interdisciplinary studies and graduated in 1952 with a double degree in English and Philosophy ."
42691865,he,was responsible for,be responsible for,palakkad unit of indian telephone industries limited from inr 40 million unit,He was responsible for expanding Palakkad unit of Indian Telephone Industries Limited from a INR 40 million unit to an INR 2 billion enterprise .
67352084,he,was,be,president of society from 1993 to 1995,He was president of the Society for Experimental Biology from 1993 to 1995 and an elected fellow of the Royal Society of Edinburgh and Royal Society of Biology .
49280323,first women,has,have,rights convention,"As a member of the editorial committee for the 1848 Seneca Falls Convention , the first women 's rights convention , Foote was one of the signatories of the convention 's Declaration of Sentiments ."
514505,el 's probe,was,be,programmed,"In Kryptonian society , scientific achievement was a preeminent virtue , so Jor - El 's probe was programmed to seek out the leading scientific mind on Earth , presumably to adopt Kal - El ."
41780297,groundbreaking ceremonies,were held in,be hold in,late summer 2017,"In late summer and fall 2017 , groundbreaking ceremonies were held for a new Football Operations Complex , new School of Nursing building , and a new home for the Collat School of Business and Harbert Institute for Innovation and Entrepreneurship ."
2058370,doctor sivana,introduced as,introduce as,built man,"Introduced as a well - built man of average height , using his magic - seeing eye causes Doctor Sivana to slowly wither to a form resembling his stooped , traditional Fawcett appearance ."
55734947,he,accept,accept,professor emeritus position at kbcs division of isi,"Upon his retirement as the head of ECSU , he was honored to accept a Professor Emeritus position at the newly formed Knowledge - based Computer Systems ( KBCS ) division of ISI , which he helped build from the ground up ."
37234529,she,was godly,be godly,gain,"In addition , she was a Godly woman that aimed to gain a deeper relationship with God while in school ."
902,nuclides,are referred to,be refer to,to isotopes,"About 339 nuclides occur naturally on Earth , of which 252 ( about 74 % ) have not been observed to decay , and are referred to as "" stable isotopes "" ."
50478167,epitaxy,became,become,as it depends on growth of perfect crystals,"With the advance of the semiconductor industry from the 1960s onward , epitaxy became extremely important as it depends on the growth of perfect single crystals for the manufacturing of transistors and IC circuits ."
65548660,she,went on,go on,to work for united states war department during world war ii,"In the 1930s , she was hired by the National Voice Amplifying Company as chief chemist , and went on to work for the United States War Department during World War II ."
60539479,he,has,have,has leading researcher with focus on ozone depletion,"He has been a leading researcher on the chemistry of the atmosphere with special focus on stratospheric ozone depletion , climate change , and air quality ."
412419,character,was intended exclusively for,be intend exclusively for,comics market,The character was initially intended exclusively for the British comics market .
28884718,dr wallace,was,be,chair,"Dr Wallace was chair of NicOx 's Scientific Advisory Board from 1996 to 2003 , which included Nobel Laureates Bengt Samuelsson and Louis Ignarro ."
25011,mixotrophs,are more important for,be more important for,ecology,"Studies have shown that mixotrophs are much more important for the marine ecology than previously assumed , and comprise more than half of all microscopic plankton ."
32257728,mark viverito,responded soon afterwards on,respond soon afterwards on,her twitter account,"Rosselló described Mark - Viverito as a , Spanish for whore ; Mark - Viverito responded to this soon afterwards on her Twitter account , condemning his use of the word ."
20879377,ponoroff,practiced law after,practice law after,graduating from law school,"After graduating from law school , Ponoroff practiced law for eight years ( including two as a partner ) and taught at several institutions , including the University of Michigan Law School and Wayne State University Law School ."
5946995,ludwig,converted from,convert from,ruined old manor house,"Much of what was his property now belongs to the American actor Michael Douglas , notably the Moorish style palace ' S'Estaca ' that Ludwig converted from a ruined old manor house ."
11490381,steinberg,was,be,recipient of honors from russian government for his devotion in literary fields,Steinberg was the recipient of many honors from the Russian government for his devotion and many - sided activities in both literary and educational fields .
41207216,he,has organised,have organise,ever international series of meetings on digital signal processing,"He has organised the first ever international series of meetings on digital signal processing , in London initially in 1967 , and in Florence ( with Vito Cappellini ) since 1972 ."
59733371,nembhard,is,be,certified,"Nembhard uses statistics and productivity to develop systems engineering approaches to improve healthcare , and is a certified Six Sigma black belt ."
47709893,she,was,be,from october 2017 deputy director general at world health organization,"Previously , from October 2017 to March 2019 , she was the Deputy Director General of Programmes ( DDP ) at the World Health Organization ."
1832144,gozer 's return,creating,create,trap for gozer on his property,"Egon spent years preparing to stop Gozer 's eventual return , creating a gigantic trap for Gozer on his property , and in the process , earning the nickname "" Dirt Farmer "" by Summerville 's residents because of his eccentricity and not growing anything on his land ."
31509,bruce,will leaves,will leave,items to heroes,"In his video will , Bruce leaves various items to other heroes and his allies including leaving Doctor Strange his notes on the Hulk 's ability to perceive ghosts and an egg - timer for the various former / current other Hulks ( based on one of Bruce 's more successful attempts to control himself as he would sit down for three minutes doing nothing before making a particularly big decision and then decide if he still wanted to do it ) ."
64262581,2021 mayoral election,is in,be in,zagreb,"In the 2021 mayoral election in Zagreb , Tomašević received a record number of votes in both rounds ."
53707293,dr. mcilwraith,became,become,university distinguished professor,Dr. McIlwraith became a University Distinguished Professor in 2009 and has also been the Director of the Musculoskeletal Research Program ( which has been a program of research and scholarly excellence at Colorado State University ) since 2003 .
65740026,she,works on,work on,development with communities on policy as former un climate change negotiator,"In addition to her scientific research , she works on sustainable development with indigenous communities in Panama and on policy as a former UN climate change negotiator for Panama and leads climate change initaitives in Canada ."
339616,peale,obtained,obtain,american patent rights about time as purchase of one,"Around 1804 , Peale obtained the American patent rights to the polygraph from its inventor John Isaac Hawkins , about the same time as the purchase of one by Thomas Jefferson ."
24340916,alexander henry flax,was born in,be bear in,new york,"Alexander Henry Flax was born in Brooklyn , New York , on January 18 , 1921 , the son of David Flax , a businessman , and Etta Flax ."
32658806,molecular signals,is in,be in,environmental biology of cholera pathogen,Currently Faruque and his team have been studying the role of quorum sensing and bacterial communication through molecular signals in the environmental biology and epidemiology of the cholera pathogen .
43557941,her interest,is,be,where pursued,"Her focus has been in cell biology , where her interest in protein trafficking and secretion is pursued using techniques such as microscopy and fluorescence imaging ."
5732209,he,became,become,doctor of technical sciences,"He became Doctor of Technical ( computer ) Sciences in 1997 , with a doctor thesis on Generalized nets , and three years later defended a second higher doctorate , Doctor of Mathematical Sciences , with a thesis in the other field of his scientific interest - intuitionistic fuzzy sets ."
42691865,invitation,set up,set up,firm,"In the early 1970s , he received an invitation from the Kerala government to set up an electronics manufacturing firm ."
58595040,he,has popularized,have popularize,usage of specific agents for delivery of chemotherapy agents,He has popularized the usage of specific targeting agents for the delivery of chemotherapy agents to cancerous cells found within a cancer patient .
8202826,foundation,conducting,conduct,further research,A report in early 2019 indicated that the Foundation would be conducting further research into the use of LSD to trigger long - term improvements in creativity .
1021540,crains new york business,named,name,sexton one of its 25 people,"In its 25th anniversary issue in June 2010 , Crains New York Business named Sexton one of its "" 25 People to Watch "" ."
21684452,blauert,is fellow of,be fellow of,institute,"Blauert is a fellow of the Acoustical Society of America , the Institute of Electrical and Electronics Engineers , the Institute of Acoustics , and the Audio Engineering Society ."
54722620,maddock,was,be,removed,"Maddock was removed from Aldermaston in 1965 to serve as Deputy Controller B at the Ministry of Technology , being made Controller in 1967 ."
2062757,its conclusion,theme of,theme of,decay,"The overarching theme of decay reaches its conclusion in Baker 's final story "" Logopolis "" ( 1981 ) , which Bidmead personally wrote ."
3933873,he,was left without,be leave without,drive,He then enjoyed a number of very strong outings for the Creation / AIM LMP1 team in Europe and America before the 2008 recession resulted in the closure of the team and he was again left without a drive .
3466910,they,would follow up on,would follow up on,hinted android,"They would also follow up on the hinted android in stasis from the Charlton series , which would eventually become "" Carapax , the Indestructible Man "" ."
65277090,he,is scheduled,be schedule,to appear before military judge on 15 november,"He is scheduled to appear before a military judge on 15 November , in a session closed to the public ."
46999422,timothy vogus,demonstrated,demonstrate,its importance for healthcare,Sutcliffe and Timothy Vogus of Vanderbilt University empirically validated the well - established theoretical construct of high reliability organizing and demonstrated its importance for healthcare .
36399133,tprc,quickly attained recognition as,quickly attain recognition as,institution,"Under Touloukian 's technical and administrative leadership , TPRC quickly attained national and international recognition as a unique institution ; the first of its kind ."
64146,such currents,are,be,known today as birkeland currents,Such field - aligned currents are known today as Birkeland currents in his honour .
40670505,his research,focuses on,focus on,heritage of communities,His research focuses on the heritage of the Christian - Eastern communities and is unique in the United States .
615035,gregory thomas linteris,is scientist,be scientist,flew,"Gregory Thomas Linteris , Ph.D. ( born October 4 , 1957 in Englewood , New Jersey ) is an American scientist who flew as a payload specialist on two NASA Space Shuttle missions in 1997 Education ."
47497,supervillains,are genre crossing villains,be genre cross villain,exist in adventures in world,"These supervillains are genre - crossing villains who exist in adventures "" in a world in which the ordinary laws of nature are slightly suspended "" ; characters such as Professor Moriarty , Count Dracula , Auric Goldfinger , Hannibal Lecter , Joker , Lex Luthor , and Darth Vader , also fit this description ."
65615549,she,was,be,for years curator of ussr ministry of geology,"For many years , she was the curator of the USSR Ministry of Geology , the chairman of expert commissions on all - Union and mineral - raw material problems ."
6869432,dr schweitzer,than,than,hospital at lamborene in equatorial africa,"Denton located a population of chimpanzees at the Institute of Primate Research at Franceville , Gabon , approximately 100 km further up the Ouguie river than Dr Schweitzer ’s Hospital at Lamborene in Equatorial Africa ."
4031,he,also served as,also serve as,shipboard radio operator,"He also served in the U.S. Navy in World War I , as a shipboard radio operator , as an editor of a publication , and as commander of the crash rescue boat USS "" Inca "" ."
514505,atrocities,watch,watch,horrors,"After witnessing these atrocities , Jor - El is forced to watch the horrors of mankind over the centuries and is represented as Mister Oz , who had been monitoring Superman since his pre - "" Flashpoint "" counterpart appeared during storylines of "" The New 52 "" , a line - wide revision of DC superhero comic books ."
3037911,he,serve study in,serve study in,review panel of huemul project,"The Argentine government requested that he return to Argentina in 1952 , a few months before the expiration of his scholarship , to serve in the scientific review panel of the Huemul Project , a study on nuclear fusion conducted by Ronald Richter ."
62273588,she,was elected in,be elect in,2019,She was elected to the National Academy of Medicine in 2019 .
55693168,its decision,stop,stop,legal procedures,"The Court concerned with integrity issues / the presidency of the Baghdad Appeal Court / Federal Rusafa / Supreme Judicial Council issued on 3/12/2019 its decision to stop the legal procedures against her according to the provisions of Article 305 , and thus the minister was acquitted ."
51728610,he,joined donald l. snyder,join donald l. snyder,at washington university work,"Miller 's work in the field of brain mapping via Medical imaging , specifically statistical methods for iterative image reconstruction , began in the mid 1980s when he joined Donald L. Snyder at Washington University to work on time - of - flight positron emission tomography ( PET ) systems being instrumented in Michel Ter - Pogossian 's group ."
65154383,xavier,drinks heavily,drink heavily,cope with his failures,"In addition , Xavier is living under the care of McCoy , is impolite to people , uses profane language , occasionally behaves violently , and drinks heavily to cope with his failures ."
62220085,he,is known in,be know in,particular,"In particular , he is best known for deterministic approximation approaches to network information theory and coded computing ."
61683464,he,significantly changed,significantly change,way,"Specifically , from 1942 to 1944 , he was a consultant to the special training division of the United States Army , where he significantly changed the way in which the Army trained illiterate soldiers ."
60236002,shapiro,was,be,assistant professor of mathematics from 1969 to 1976,Shapiro was an assistant professor of mathematics at University of Minnesota from 1969 to 1976 and was a visiting professor of economics from 1976 to 1977 .
18436744,institute,does research in,do research in,context of empowering people from work over leisure to domestic tasks,The institute does research on robots in the context of empowering people in their daily lives from work over leisure to domestic tasks .
23982302,bernardi,is also officer in,be also officer in,united states navy reserves,Bernardi is also an officer in the United States Navy Reserves .
13017167,she,order of,order of,lakandula,"In 1980 , she was conferred the rank and title of National Scientist of the Philippines , and in 2010 , she was conferred the Order of Lakandula ."
67975491,particular attention,is paid,be pay,participation of cells in development of processes,"Particular attention is paid to the study of cellular and molecular mechanisms of nerve cell damage in the development of cerebral pathologies , the influence of neuropathies on neuronal and synaptic plasticity , the participation of glial cells in the development of neurodegenerative processes ."
25185491,grabar,was,be,born on 10/22 january 1865 in vienna at home located during rise of movements,"Grabar was born on 10/22 January 1865 in Vienna , Austria at a home located on Währinger Hauptstrasse , 214 , during the rise of European national movements ."
40873708,he,american co-director of,american co-director of,johns hopkins university nanjing university center for chinese in prc,From 1993 and until 1995 he became the American Co-Director of the Johns Hopkins University - Nanjing University Center for Chinese and American Studies in the PRC .
3229591,he,was leading representative in,be lead representative in,century,He was a leading representative of science and technology in the 18th century Kingdom of Hungary and Habsburg Monarchy .
19831,she,was,be,at unaware about post-war collective guilt,"Those present were shocked to hear Thatcher 's utterances and "" appalled "" at how she was "" apparently unaware "" about the post-war German collective guilt and Germans ' attempts to work through their past ."
213498,blue jays,can also copy so well,can also copy so well,cries of local hawks,Blue jays can also copy the cries of local hawks so well that it is sometimes difficult to tell which it is .
16188,canids,are group of,be group of,large carnivores,The wolf - like canids are a group of large carnivores that are genetically closely related because they all have 78 chromosomes .
44408938,he,studied at,study at,international scientific educational center with major in history,From 2010 to 2012 he studied at the International scientific - educational center of the National Academy of Sciences ( NAS ) with a major in history .
5516258,he,initially triggers,initially trigger,plot,"Doctor Nefarious is a playable character in the game ' , where he initially triggers the plot by tricking Qwark into fighting a giant Light - eating Z'Grute only to be attacked by his own creature ."
43823852,he,has contributed in,have contribute in,physics education among indian students by conducting lectures,He has immensely contributed in popularising Physics education among Indian students and teachers by conducting lectures and experimental demonstrations .
26196830,baker,was professor before,be professor before,immediately coming,"Immediately before coming to Syracuse , Baker was Professor of Forestry at the Pennsylvania State College ."
22604261,takahashi 's lab,has continued use,have continue use,lead to discoveries of role of circadian clock in vision among properties,"Takahashi 's lab has continued use of this method in order to lead to discoveries of the role of the circadian clock in vision , learning , memory , stress , and addiction , among other behavioral properties ."
1980559,doctor,is time from,be time from,planet gallifrey,"Within the series ' narrative , the Doctor is a centuries - old alien Time Lord from the planet Gallifrey who travels in time and space in the TARDIS , frequently with companions ."
61561467,she,continues,continue,actively engaged,"Although retired , she continues to be actively engaged as an invited speaker , in the WMO and its Executive Council and through the WMO Commission on Basic Systems , coordinating earth observations ."
13788553,child,lived on,live on,estate,"A child of privilege , Dorothy lived on a large estate with her parents , brother , sister , aunts , uncles , and several cousins ."
157313,she,voiced,voice,her concern about disturbing content,"Specifically , she voiced her concern about the disturbing content in YouTube videos targeted at children , involving suggestive imagery and violence while using popular children 's figures such as "" Frozen "" 's Elsa and Spider - Man ."
56722951,he,was,be,on his return to uk appointed to position as assistant to consultant paediatrician,On his return to the UK he was appointed to a position as an assistant to the consultant paediatrician at Great Ormond Street Hospital .
66144294,villadolid,introduced,introduce,practice,"As early as 1950 , Villadolid introduced the practice of farming tilapia ."
53588968,hunt,years later published brief history in,year later publish brief history in,1979,"A few years later , in 1979 , Hunt published "" A Brief History of Women Workers and Hazards in the Workplace "" ."
62129367,he,graduated with,graduate with,b.s. degree from engineering department,"He graduated with a B.S. degree from the electrical engineering department of Shanghai Jiao Tong University in 1935 , and enrolled at the graduate school of Stanford University in the United States in 1937 on a Chinese government scholarship ."
