document_id,subject_str,subject_id,subject_type,predicate_org,predicate,object_str,object_id,object_type,text
7713110,griff,Griff,PERSON,is,be,official,http://www.wikidata.org/entity/Q3502546,Profession,"Also , the griffin is the official mascot of Maria Clara High School , known as the Blue Griffins in PobCaRan cluster of Caloocan , Philippines , which excels in cheerleading ."
28957129,logue,Logue,ORG,became,become,speech therapist,http://www.wikidata.org/entity/Q11762416,Profession,Logue became a founding fellow of the Royal College of Speech and Language Therapists in 1944 .
215430,pupin,Pupin,PERSON,was,be,march,http://www.wikidata.org/entity/Q611694,Award,"Pupin was a founding member of National Advisory Committee for Aeronautics ( NACA ) on 3 March 1915 , which later became NASA , and he participated in the founding of American Mathematical Society and American Physical Society ."
56991643,pamir,Pamir,NORP,is in,be in,pamirs,Pamirs,ORG,"On his initiative , being at the same time the chairman of the Pamir scientific research base and a Member of the Presidium of the Academy of Sciences of the Tajik SSR , the Department of Pamir Studies from the Rudaki Institute of Language and Literature was relocated to Khorog from Dushanbe ; the Department of Social and Economic Research of the Pamir Research Base in the Pamirs was established , later on the basis of these two departments after his death ( 11/27/1990 ) , in 1991 the Institute of Humanities in the Pamirs was established Death ."
56851742,clifford f. mass,Clifford F. Mass,PERSON,is,be,american,American,NORP,Clifford F. Mass is an American professor of Atmospheric Sciences at the University of Washington .
39338078,dreger,Dreger,PERSON,has,have,ted talks,TED Talks,ORG,Dreger has been a featured speaker at TED Talks .
4031,farrell,Farrell,PERSON,during,during,bear island,Bear Island,LOC,"He was described as "" tireless "" by Barry Farrell in "" Life "" magazine , who noted that Fuller stayed up all night replying to mail during Farrell 's 1970 trip to Bear Island ."
26564559,steven moffat,Steven Moffat,PERSON,in,in,doctor,Doctor,PERSON,"In Steven Moffat 's Ninth Doctor short story "" ' What I Did on My Christmas Holidays ' by Sally Sparrow "" the Doctor and the TARDIS are inadvertently separated twenty years in time by a fault in the time machine and the Doctor is able to instruct Sally how to bring it back to him in the past ."
412419,captain,http://www.wikidata.org/entity/Q849424,Profession,has,have,comic,http://www.wikidata.org/entity/Q245068,Profession,"This has included Captain Britain 's first original appearance in UK comics in thirteen years , with a story that ran in "" Spectacular Spider - Man Adventures "" and Panini plan to have more in their new all - ages title "" Marvel Heroes "" ."
902,atomic,http://www.wikidata.org/entity/Q652,Language,forms,form,range,http://www.wikidata.org/entity/Q3913345,Language,This atomic matter forms networked arrangements that lack the particular type of small - scale interrupted order associated with molecular matter .
53277860,lian pin koh,http://www.wikidata.org/entity/Q23670480,Person,is,be,singaporean,Singaporean,NORP,Lian Pin Koh ( born 1976 in Singapore ) is a Singaporean conservation scientist .
756418,luzkhov,Luzkhov,PERSON,died in,die in,munich,Munich,GPE,"Luzkhov died on 10 December 2019 in Munich , Germany at the Klinikum der Universität München where he underwent invasive heart surgery ."
30873261,snouck,Snouck,ORG,was examined by,be examine by,scholar,http://www.wikidata.org/entity/Q2248623,Profession,"Snouck , who was fluent in Arabic , through mediation with the Ottoman governor in Jeddah , was examined by a delegation of scholars from Mecca in 1884 and , upon successfully completion of the examination , was allowed to commence a pilgrimage to the Holy Muslim city of Mecca in 1885 ."
736,secretary,http://www.wikidata.org/entity/Q5131856,Profession,originally slated,originally slate,swiss,Swiss,NORP,"Originally slated to serve as the Swiss delegate , Secretary - General Eric Drummond was persuaded by Catholic activists Oskar Halecki and Giuseppe Motta to instead have him become the German delegate , thus allowing Gonzague de Reynold to take the Swiss spot , from which he promoted traditionalist Catholic values ."
26564527,doctor,Doctor,WORK_OF_ART,is,be,gallifrey,Gallifrey,PERSON,"Within the series ' narrative , the Doctor is a centuries - old alien Time Lord from the planet Gallifrey who travels in time and space in the TARDIS , frequently with companions ."
19831,major,Major,PERSON,is in,be in,commons,Commons,ORG,"The Conservatives won a 44 - seat majority in the House of Commons , and Thatcher became the first female British prime minister ."
26468275,logan,Logan,PERSON,was,be,windsor,Windsor,GPE,"In 1972 , nearly twenty years before Logan was romantically involved and abducted with Silver Fox at Windsor snow lodge , Professor Thorton experimented on numerous mutants including Sabretooth and Mastodon ."
62912967,olduvai,Olduvai,GPE,gona in,gona in,ethiopia,Ethiopia,GPE,"Toth has conducted archaeological field research and studied the lithic assemblages from Oldowan and Acheulean sites including Olduvai Gorge in Tanzania , Dmanisi in the Republic of Georgia , Gona in Ethiopia , Middle Awash in Ethiopia , Nihewan Basin in China , Lake Natron in Tanzania , Ambrona in Spain , and Koobi Fora in Kenya ."
70631,russian,Russian,LANGUAGE,entice,entice,humboldt,Humboldt,ORG,"The Russians sought to entice Humboldt by engaging his enduring interest in mining sites , for comparative scientific purposes for Humboldt , but for the Russians to gain expert knowledge about their resources ."
36450041,d'auvergne,D'Auvergne,GPE,be duke,be duke,d'auvergne,d'Auvergne,ORG,"D'Auvergne was now known as the Prince of Bouillon , and would be Duke of Bouillon if Jacques Léopold de La Tour d'Auvergne died without issue ."
2012734,floro,Floro,PERSON,contact,contact,green,Green,ORG,"In "" The Saga of the Swamp Thing "" ( vol. 2 ) # 22 ( March 1984 ) , the Floronic Man uses the Swamp Thing 's body — now regressing to a plant - like state due to his inability to accept the new revelation about his origins , Woodrue literally eating parts of him — to contact the Green , which is composed of the life force of all plants on Earth ."
57426599,floronic man,Floronic Man,ORG,discovers,discover,green,Green,ORG,"The Floronic Man returns to the swamp and discovers the Swamp Thing 's connection to the Green , but the experience drives him mad ."
62394085,sauter,Sauter,PERSON,is,be,management scientist,http://www.wikidata.org/entity/Q89000321,Profession,Vicki Lynn Sauter ( born 1955 ) is an American management scientist and systems engineer known for her books on decision support systems .
64568069,hiralal chaudhuri,Hiralal Chaudhuri,PERSON,was,be,21 november 1921,21 November 1921,DATE,"Hiralal Chaudhuri was born on 21 November 1921 in the village of Kubajpur , adjacent to the Surma Valley in Sylhet ( then "" Srihatta "" ) , Assam ( in present - day "" Bangladesh "" ) , British India ."
38551935,macmasters,MacMasters,PERSON,admitted to,admit to,crompton,Crompton,PERSON,"Legend has it that after a half - bottle of whisky , MacMasters admitted to Crompton his sly attempt at cost cutting by sourcing a cheaper metal for his filaments ."
62737100,del rosario,del Rosario,PERSON,was born in,be bear in,philippine,Philippine,NORP,"On June 13 , 1896 , Del Rosario was born in Bantayan in the Philippine province of Cebu ."
64146,birkeland,Birkeland,PRODUCT,was born to,be bear to,birkeland,Birkeland,ORG,Birkeland was born in Christiania ( Oslo today ) to Reinart Birkeland and Ingeborg ( née Ege ) and wrote his first scientific paper at the age of 18 .
215430,pupin,Pupin,PERSON,was born in,be bear in,idvor,Idvor,PERSON,"Mihajlo Pupin was born on 4 October ( 22 September , O.S. ) 1858 in the village of Idvor ( in the modern - day municipality of Kovačica , Serbia ) in the region of Banat , in the Military Frontier of the Austrian Empire ."
44058966,german,German,NORP,is in,be in,world war ii,World War II,EVENT,"During the German occupation of Denmark in World War II , Grønbech 's lectures drew large audiences , and after the war he founded the periodical "" Frie Ord "" with the theologian Hal Koch ."
14907770,clynes,Clynes,ORG,played versions by,play version by,vladimir horowitz,Vladimir Horowitz,PERSON,"When they arrived , Clynes played versions of the same Mozart sonata K 330 by six famous artists , including Vladimir Horowitz , Alicia de Larrocha , Claudio Arrau , and Mitsuko Uchida , and included the computer performance at a random position among them ."
57324380,slavist,http://www.wikidata.org/entity/Q15976341,Profession,originators of,originator of,russian,http://www.wikidata.org/entity/Q7737,Language,"Victor Ivanovich Grigorovich ( ; 30 April 1815 – 19 December 1876 ) was a Russian Slavist , folklorist , literary critic , historian and journalist , one of the originators of Slavic studies in the Russian empire ."
6133060,forsberg,Forsberg,PERSON,gave speech at,give speech at,annual,annual,DATE,"In December 1979 , Forsberg gave a speech in Louisville at the annual meeting of Mobilization for Survival , an anti-nuclear organization ."
206211,summer,Summer,ORG,was appointed to,be appoint to,director,http://www.wikidata.org/entity/Q2824523,Profession,"Upon the inauguration of Barack Obama as president in January 2009 , Summers was appointed to the post of director of the National Economic Council ."
57426599,holland,Holland,PERSON,appears in,appear in,comic,http://www.wikidata.org/entity/Q245068,Profession,"Alec Holland appears in a five - page backup in issue # 16 of the DC Animated Universe comic , "" The Batman Adventures "" ."
27936,jameson,Jameson,PERSON,as,as,editor,http://www.wikidata.org/entity/Q23016178,Profession,"Despite his role as Jameson 's editor and confidant , Robbie Robertson is always depicted as a supporter of both Peter Parker and Spider - Man ."
5260842,garnet,Garnet,ORG,was american engineer of,be american engineer of,rensselaer polytechnic institute,http://www.wikidata.org/entity/Q49211,Language,"Garnet Douglass Baltimore ( April 15 , 1859 – June 12 , 1946 ) was the first African - American engineer and graduate of Rensselaer Polytechnic Institute in Troy , New York , Class of 1881 ."
62070,curie,Curie,FAC,became,become,french,French,NORP,"Joliot - Curie became actively involved in promoting women 's education , serving on the National Committee of the Union of French Women ( "" Comité National de l'Union des Femmes Françaises "" ) and the World Peace Council ."
58602531,dahleh,Dahleh,PERSON,is,be,professor,http://www.wikidata.org/entity/Q37226,Profession,"Munther A. Dahleh ( born 1962 , Tulkarem , Palestine ) is the William Coolidge Professor of electrical engineering and computer science and director of the Massachusetts Institute of Technology ( MIT ) Institute for Data , Systems , and Society ( IDSS ) ."
863091,petros,Petros,PERSON,addressed,address,armenia,http://www.wikidata.org/entity/Q399,Country,"On 23 February 2013 , Ter - Petrosyan addressed the gathered at the Pan-Armenian National Movement party convention ."
64566331,goodwin,Goodwin,PERSON,was,be,marine,http://www.wikidata.org/entity/Q2962165,Language,"During her time at UCT , Goodwin was a visiting researcher at the Centre of Marine Biology , Baltimore , USA ."
47943316,marron,Marron,PERSON,was,be,chief executive officer,http://www.wikidata.org/entity/Q484876,Profession,Marron was the inaugural Chief Executive Officer .
54042926,feinberg,Feinberg,PERSON,told,tell,msnbc,MSNBC,ORG,"After a lawsuit by private investigator Rod Wheeler against Fox News alleged that members of the Trump administration had a hand crafting a story ( which was later retracted ) which pushed the Seth Rich murder - conspiracy theory , Feinberg told Joy - Ann Reid of MSNBC that it was "" troubling "" that both the White House and a Russian propaganda service were both attempting to promote the discredited story ."
26564527,actor,http://www.wikidata.org/entity/Q33999,Profession,was,be,tardis,TARDIS,PRODUCT,"The only factor keeping the original sequence of events in play was the Doctor 's TARDIS , which had rebuilt itself after its apparent destruction on Avalon , and had now materialised in a twisted form above Gallifrey , holding within itself the Doctor 's original reality where he had regenerated on Metebelis III and never been infected ever since it sensed that something was wrong when the Third Doctor regenerated ahead of schedule ."
49130253,university,University,ORG,is in,be in,italy,Italy,GPE,"Today , the CRB - CIRIAF is the only University in Italy by inter-research that offers a PhD course ."
7732,magneto,Magneto,PRODUCT,reveal,reveal,cyclops,Cyclops,PRODUCT,"Xavier and Magneto reveal the contents of the USB drive to Cyclops , which are shown to be information on Orchis , an organization dedicated to responding to a large - scale mutant threat and the plans of a Mother Mold ."
171133,comenius,Comenius,EVENT,was greatly influenced by,be greatly influence by,irish,http://www.wikidata.org/entity/Q9142,Language,"Comenius was greatly influenced by the Irish Jesuit William Bathe as well as his teachers Johann Piscator , , and particularly Heinrich Alsted ."
70631,alexander von humboldt,Alexander von Humboldt,PERSON,is,be,german,German,LANGUAGE,""" Alexander von Humboldt "" is also a German ship named after the scientist , originally built in 1906 by the German shipyard AG Weser at Bremen as Reserve Sonderburg ."
70631,humboldt,Humboldt,GPE,attended,attend,university,http://www.wikidata.org/entity/Q917874,Language,"Together , Humboldt and Goethe attended university lectures on anatomy and conducted their own experiments ."
48634090,ann alicia copestake,http://www.wikidata.org/entity/Q21535076,Person,fellow of,fellow of,wolfson college,Wolfson College,ORG,"Ann Alicia Copestake is professor of Computational Linguistics and head of the Department of Computer Science and Technology at the University of Cambridge and a fellow of Wolfson College , Cambridge ."
37067,sommerfeld,Sommerfeld,PERSON,took,take,debye,Debye,GPE,"In 1906 , Sommerfeld received an appointment at Munich , Bavaria , and took Debye with him as his assistant ."
26266730,crash,Crash,LOC,hires n. gin in,hire n. gin in,tapes,http://www.wikidata.org/entity/Q6754640,Language,"In the subsequent tapes , which take place following Crash 's escape from Cortex 's castle , Cortex trains Crash 's sister , whom he codenames "" Coco "" , hires N. Gin , and creates Dingodile as a potential substitute for Coco , who ultimately escapes Cortex 's castle under the guise of undertaking another trial ."
736,einstein,Einstein,ORG,accepting,accept,austrian,Austrian,NORP,"Einstein became a full professor at the German Charles - Ferdinand University in Prague in April 1911 , accepting Austrian citizenship in the Austro - Hungarian Empire to do so ."
7732,xavier,Xavier,PERSON,however was revealed,however be reveal,mystique,Mystique,PERSON,"However , this Xavier was revealed to be Mystique who Osborn found to impersonate Xavier in public ."
2624320,maestlin,Maestlin,PERSON,recounts in,recount in,kepler,Kepler,PERSON,"In a 1589 letter to Johannes Kepler , Maestlin recounts how the death of his month - old son , August , deeply troubled him ."
58622641,o'connor,O'Connor,PERSON,is also fellow of,be also fellow of,royal society,http://www.wikidata.org/entity/Q123885,Academia of Science,"O'Connor was elected a Fellow of the Royal Society of New Zealand in 1986 , and is also a Fellow of the Royal Society of Chemistry and a Fellow of the New Zealand Institute of Chemistry ."
1937060,strange,Strange,PERSON,has,have,earth,Earth,LOC,"Tom Strange is capable of flight ( or at least vast Golden Age Superman - like leaps ) , superhuman strength , and surviving indefinitely in the vacuum of space ( without air or water ) , and has invulnerability to re-entry , extreme impacts ( falling to Earth from space ) and bullets ."
1932128,doctor,http://www.wikidata.org/entity/Q4618975,Profession,is usurped by,be usurp by,darrin profitt,Darrin Profitt,PERSON,"During the "" 4th Parallel "" storyline in "" JLA Classified "" , Doctor Destiny 's control over the Materioptikon is usurped by Darrin Profitt , the Red King ."
50566828,langer,Langer,PERSON,is holder of,be holder of,france,http://www.wikidata.org/entity/Q142,Country,"Dr. Langer has published more than 450 scientific articles and is holder of at least 21 patents in France , the United States and Japan ."
19831,thatcher,Thatcher,PERSON,has,have,opposition,Opposition,ORG,"Believing that the single market would result in political integration , Thatcher 's opposition to further European integration became more pronounced during her premiership and particularly after her third government in 1987 ."
25010143,karim,Karim,PERSON,had,have,teachers,http://www.wikidata.org/entity/Q974144,Profession,"Karim , in addition to his teaching assignment , had been presidents of Dhaka University Teachers Association , Federation of Bangladesh University Teachers Association and soil science society of Bangladesh ."
80990,gorgon,Gorgon,PRODUCT,occur in,occur in,greek,http://www.wikidata.org/entity/Q41,Country,Gorgons occur in the earliest examples of Greek literature .
49828,von guericke,Von Guericke,ORG,was man in,be man in,dionysian,Dionysian,NORP,Von Guericke was a very pious man in the Dionysian tradition and attributed the vacuum of space to the creations and designs of an infinite divinity .
61972444,brundle,Brundle,PERSON,known as,know as,brundlefly,Brundlefly,PERSON,"Dr. Seth Brundle , also known as Brundlefly , is a fictional character and the anti-villain protagonist in David Cronenberg 's 1986 remake of "" The Fly "" ."
3119314,brainiac,Brainiac,PERSON,saved,save,psimon,Psimon,PERSON,"In Pre-Crisis continuity , Brainiac and the Earth - 1 Lex Luthor saved Psimon from the Anti-Monitor 's Shadow Demons and recruited him for their villain army , taking over Earths 4 , S , and X ."
36825543,pickard,Pickard,PERSON,was,be,battersea polytechnic,Battersea Polytechnic,ORG,Pickard was Principal of Battersea Polytechnic ( which later became the University of Surrey ) from 1920 to 1927 .
55874079,positions,http://www.wikidata.org/entity/Q11488158,Profession,is in,be in,ghana,http://www.wikidata.org/entity/Q117,Country,"He served in several positions in the Ghana Health Service , including being Chief Physician for Nutrition and the Director of Medical Services ."
163036,richardson,Richardson,PERSON,played,play,simeon,Simeon,PERSON,"For television , Richardson played Simeon in "" Jesus of Nazareth "" ( 1977 ) , made studio recordings of "" No Man 's Land "" ( 1978 ) and "" Early Days "" ( 1982 ) , and was a guest in the 1981 Morecambe and Wise Christmas Show ."
27302119,comics,http://www.wikidata.org/entity/Q245068,Profession,' series is,series be,atlantis,Atlantis,PRODUCT,"In The New 52 , the 2011 relaunch and retcon of DC Comics ' entire series , Vulko is the former adviser of Atlantis ."
65277090,fields medal,http://www.wikidata.org/entity/Q28835,Award,emeritus at,emeritus at,university,http://www.wikidata.org/entity/Q917874,Language,"Over 350 academic and professional colleagues signed the petition , among them Freeman Dyson , Professor Emeritus of Physics at the Institute for Advanced Study in Princeton ; Fields Medal laureate David Mumford , Professor Emeritus of Mathematics at Brown University ; Chandler Davis , Professor Emeritus of Mathematics at the University of Toronto and Noam Chomsky ."
7732,daken,Daken,PERSON,won,win,xavier,Xavier,PRODUCT,Just as Daken appears to have won Xavier pulls both of them onto the astral plane revealing that the psychic bomb had little effect on him because his psyche was already shattered .
56064277,lindberg,Lindberg,ORG,was born as,be bear as,manager,http://www.wikidata.org/entity/Q6746710,Profession,"John Gustaf Lindberg was born to Gustaf Robert Lindberg ( 1844 – 1929 ) , a Finnish engineer working in St. Petersburg , Russia , as a department manager in St. Petersburg Metalworks supervising the construction of boilers for steam engines and of metal bridges , and Anna Heloise Rautelin ."
34602710,medal,http://www.wikidata.org/entity/Q131647,Award,was,be,award,http://www.wikidata.org/entity/Q66744316,Award,He was later awarded the Muybridge Medal of the International Society of Biomechanics ( ISB ) and the Lifetime Achievement Award of The Gait and Clinical Movement Analysis Society .
736,einstein,http://www.wikidata.org/entity/Q937,Person,has,have,mechanics,http://www.wikidata.org/entity/Q327029,Profession,Einstein 's objections to quantum mechanics .
36450041,d'auvergne,d'Auvergne,PRODUCT,elected,elect,fellow,http://www.wikidata.org/entity/Q10519151,Award,D'Auvergne obtained an honorary degree in 1785 and elected Fellow of the Royal Society on 11 June 1786 .
736,einstein,http://www.wikidata.org/entity/Q937,Person,was,be,pastor,http://www.wikidata.org/entity/Q152002,Profession,"Einstein 's visit was initiated by Jorge Duclout ( 1856 – 1927 ) and Mauricio Nirenstein ( 1877 – 1935 ) with the support of several Argentine scholars , including Julio Rey Pastor , Jakob Laub , and Leopoldo Lugones ."
40795117,anne balsamo,Anne Balsamo,PERSON,is former dean at,be former dean at,university,http://www.wikidata.org/entity/Q917874,Language,"Anne Balsamo is the former Dean of the School of Arts Technology and Emerging Communication at the University of Texas at Dallas , she still serves as a Professor at the school ."
66226765,dorado,Dorado,ORG,obtained,obtain,doctor,http://www.wikidata.org/entity/Q4618975,Award,"In 2018 Dorado obtained the La Caixa Young Postdoctoral Leaders Scholarship , she carried out her research titled "" Evaluación integrada de los futuros efectos del cambio climático en el crecimiento de los bosques de retaguardia en el Mediterráneo "" [ Integrated Assessment of the future effects of climate change on the growth of rearguard forests in the Mediterranean ] at the Polytechnic University of Madrid ."
23272775,westphal,Westphal,PERSON,has,have,director,http://www.wikidata.org/entity/Q3455803,Profession,"Gerry Neugebauer , who was Westphal 's predecessor as Director of Palomar Observatory , explained , "" What I liked most about Jim was how much he enjoyed science ."
26564527,big finish productions,Big Finish Productions,WORK_OF_ART,describes,describe,doctor,http://www.wikidata.org/entity/Q4618975,Award,"The Big Finish Productions website describes the Eighth Doctor as "" an enthusiastic figure who explores the universe for the sheer love of it "" , always surviving on the strength of his excellent improvisational skills rather than preparing elaborate plans ."
56991643,yusufbekov,Yusufbekov,PERSON,were revealed at,be reveal at,institute,Institute,ORG,Khudoyor Yusufbekov 's scientific and organizational abilities were revealed at the post of director of the institute .
1871881,unionist,Unionist,NORP,thereafter flew,thereafter fly,richmond,Richmond,GPE,"Thereafter a staunch Unionist , over his house flew the last Union flag in Richmond , in April 1861 ."
66431065,odingo,Odingo,ORG,was appointed,be appoint,lecturer,http://www.wikidata.org/entity/Q1569495,Profession,Odingo was appointed Lecturer in Geography at Makerere University College before moving to the University College in Nairobi in 1965 .
1130,avicenna,Avicenna,NORP,has,have,islamic,Islamic,NORP,"Avicenna 's views on Islamic theology ( and philosophy ) were enormously influential , forming part of the core of the curriculum at Islamic religious schools until the 19th century ."
2361661,massey,Massey,PERSON,served as,serve as,board member,http://www.wikidata.org/entity/Q2824523,Profession,"In concert with his roles at Argonne and the University of Chicago , in 1987 Massey was named president of the American Association for the Advancement of Science , after having served as a board member for a number of years ."
50990089,huffman,Huffman,PERSON,served as,serve as,teacher,http://www.wikidata.org/entity/Q974144,Profession,"She worked with the Chicago Museum of Science and Industry as they produced the Omnimax movie , "" Antarctica "" "" , "" and co-authored the companion book , "" Antarctica : A Living Classroom "" During summer breaks from ~ 1995 , Huffman served as a facilitator in the Golden Apple Foundation Summer Science Inquiry for Teachers workshops held at the Chicago Museum of Science and Industry and the University of Chicago ."
36391995,james john miles,http://www.wikidata.org/entity/Q6136873,Person,is retired professor in,be retired professor in,university,University,ORG,James John Miles ( born 1959 ) is a retired Professor of Computer Engineering in the School of Computer Science at the University of Manchester where he previously was head of the school and a member of the Nano Engineering & Storage Technology Research Group ( NEST ) .
10315,armstrong,http://www.wikidata.org/entity/Q4793919,Language,lashed out at_time,lash out at_time,one day,one day,DATE,"Bitter and overtaxed by years of litigation and mounting financial problems , Armstrong lashed out at his wife one day with a fireplace poker , striking her on the arm ."
64146,birkeland,Birkeland,PRODUCT,was,be,birkeland,Birkeland,PERSON,Birkeland was born in Christiania ( Oslo today ) to Reinart Birkeland and Ingeborg ( née Ege ) and wrote his first scientific paper at the age of 18 .
63442289,konstantin igorevich pozdniakov,http://www.wikidata.org/entity/Q39387217,Person,is french linguist,be french linguist,mande,Mande,LANGUAGE,"Konstantin Igorevich Pozdniakov ( born July 24 , 1952 , Leningrad , USSR ) is a Russian - French linguist who works on the comparative - historical linguistics of the Mande , Atlantic , and Niger - Congo families ."
