document_id,subject_str,subject_id,subject_type,predicate_org,predicate,object_str,object_id,object_type,text
60645118,hogue,Hogue,PERSON,attended,attend,university,http://www.wikidata.org/entity/Q917874,Language,"Hogue attended University of Wisconsin – Eau Claire , where she graduated in 1995 with a B.S. in Geology ."
2172663,basil hetzel,http://www.wikidata.org/entity/Q15504776,Person,also has,also have,hetzel,Hetzel,ORG,"In 2005 , the building for health sciences at the university 's City East campus was named the Basil Hetzel building and the campus library also has a Hetzel room which contains a collection of his research ."
31267785,degree,http://www.wikidata.org/entity/Q6008527,Award,is in,be in,reformed presbyterian,Reformed Presbyterian,NORP,"In the Reformed Presbyterian Church , admonition is the "" lowest "" degree of censure consisting "" in warning the offender of his guilt , and in exhorting him to walk circumspectly for the future . """
55617693,america,http://www.wikidata.org/entity/Q30,Country,of,of,gold medal award,Gold Medal Award,WORK_OF_ART,McCann was awarded the Archaeological Institute of America 's Gold Medal Award in 1998 and presented with a Festschrift at the ceremony .
736,university,http://www.wikidata.org/entity/Q917874,Language,is in,be in,israel,http://www.wikidata.org/entity/Q801,Country,"Einstein bequeathed his personal archives , library and intellectual assets to the Hebrew University of Jerusalem in Israel ."
70631,humboldt,Humboldt,ORG,was admitted to,be admit to,intellectual,http://www.wikidata.org/entity/Q58968,Profession,"In 1794 , Humboldt was admitted to the famous group of intellectuals and cultural leaders of Weimar Classicism ."
206211,summers,Summers,PERSON,became,become,harvard,Harvard,ORG,"Summers 's ties to Epstein reportedly began "" a number of years ... before Summers became Harvard ’s president and even before he was the Secretary of the Treasury . """
11055980,boslough,Boslough,ORG,arrive in,arrive in,chelyabinsk,Chelyabinsk,GPE,"Boslough was among the first western scientists to arrive in Chelyabinsk , where he did field research and accompanied a production crew filming Meteor Strike for "" Nova "" ."
1832144,spengler,Spengler,PERSON,is with,be with,ghostbuster,Ghostbuster,ORG,"In the episode "" Cry Uncle "" , Spengler 's well - meaning but skeptical uncle Cyrus , visits him and , since he does not believe that Spengler 's work with the Ghostbusters is real scientific work and therefore a waste of Spengler 's genius , tries to make him come back to Ohio ( where Spengler grew up ) to work at his uncle 's lab , but fortunately , after his uncle accidentally releases the Stay Puft Marshmallow Man from the containment unit , he realizes that ghosts are real and accepts Spengler 's work ."
13029367,director,http://www.wikidata.org/entity/Q3387717,Profession,is,be,approximately 650,approximately 650,CARDINAL,"The Directorate is the largest at Glenn with a workforce of approximately 650 engineers , technicians , pilots , and support personnel ."
14439096,curran,Curran,PERSON,was awarded degree from,be award degree from,university of strathclyde,http://www.wikidata.org/entity/Q1859178,Language,Joan Curran was awarded an honorary degree of Doctor of Letters from the University of Strathclyde in 1987 .
59999630,levin,Levin,PERSON,was,be,advisor,http://www.wikidata.org/entity/Q109554786,Profession,Levin was a postdoctoral fellow in the MIT Department of Biology under advisor Alan Grossman .
47497,comic,http://www.wikidata.org/entity/Q245068,Profession,ranks,rank,victor,http://www.wikidata.org/entity/Q18560095,Award,Comic Book Resources ranks Victor Von Doom as their fourth favorite Marvel character .
11114229,steele,http://www.wikidata.org/entity/Q2005691,Person,was appointed professor at,be appoint professor at,university of queensland,University of Queensland,ORG,On 20 December 1910 Steele was appointed professor of chemistry at the newly established University of Queensland .
163036,richardson,Richardson,PERSON,recorded,record,english,http://www.wikidata.org/entity/Q1860,Language,"Richardson also recorded some English Romantic poetry , including "" The Rime of the Ancient Mariner "" and poems by Keats and Shelley for the label ."
18598148,clarke,Clarke,PERSON,observed,observe,shore,http://www.wikidata.org/entity/Q34139,Language,"A year later , Clarke observed the salvage from the shore and the surface ."
69067989,gregory,Gregory,PERSON,died,die,massachusetts,Massachusetts,GPE,"Gregory died at a hospital in Holden , Massachusetts in 1954 , aged 74 years ."
44408938,artsrun hovhannisyan,http://www.wikidata.org/entity/Q16371031,Person,became,become,armenia,http://www.wikidata.org/entity/Q399,Country,"In 2012 , Artsrun Hovhannisyan became the press secretary of the Ministry of Defense of Armenia ."
