document_id,subject_str,predicate_org,predicate,object_str,text
530812,abulafia,intense disseminator of,intense disseminator of,his kabbalah orally,"As part of his messianic propensity , Abulafia become an intense disseminator of his Kabbalah , orally and in written form , trying to convince both Jews and Christians ."
911310,kass,is,be,known as proponent of liberal education via great books as critic of cloning,"Kass is best known as a proponent of liberal education via the "" Great Books , "" as a critic of human cloning , life extension , euthanasia and embryo research , and for his tenure as chairman of the President 's Council on Bioethics from 2001 to 2005 ."
62226822,martinis,being reassigned to,be reassign to,role,"In April 2020 , Wired magazine announced that Martinis reportedly resigned from Google after being reassigned to an advisory role ."
45549528,he,worked as,work as,instructor of agronomy at cornell university,"From 1903 to 1907 , he worked as an instructor and assistant professor of Agronomy at Cornell University , followed by as a professor of Agronomy in Pennsylvania State College from 1907 and 1908 ."
16559,x-men titles,fill in,fill in,missing events of six months of continuity,"During the "" Revolution "" event , all "" X-Men "" titles began six months after the events of "" Apocalypse : the Twelve "" , allowing writers to create fresh situations and stories and gradually fill in the missing events of the previous six months of continuity ."
81898,he,established,establish,branch,"In 1926 , he established a southern branch of the Lake Placid Club in Florida ."
63621711,biology,focus,focus,molecular pharmacology,"Her scientific focus includes chemical biology , molecular pharmacology , structural biology , microbiology , and infectious diseases ."
5181235,o'leary,was scientist during,be scientist during,apollo program,O'Leary was the only planetary scientist in the NASA Astronaut Corps during the Apollo program .
12829833,parnas,was,be,born in tarnopol at time in province to parents,"Parnas was born in 1884 in Tarnopol , at that time part of the Austro - Hungarian Empire , in the province of Galicia ( now split between Poland and Ukraine ) , to Jewish parents ."
2062757,white guardian,assigns,assign,task,"Shortly afterward , the powerful White Guardian assigns the Doctor the task of finding the six segments of the Key to Time , sending a young Time Lady named Romana ( as portrayed by Mary Tamm ) to assist him ."
18974154,his earliest known work,pertained to,pertain to,response of macrophages to infection,"His earliest known published work pertained to the response of peritoneal macrophages , a type of white blood cell , to infection by "" Chlamydia psittaci "" , an infectious bacterium that can be transmitted from animals to humans ."
49236987,standards,of institute is,of institute be,nist,"The international RoboCup Nanogram demonstration events were supported by the U.S. National Institute of Standards and Technology ( NIST ) in 2007 , 2008 , and 2009 ."
5969169,he,was early pioneer in,be early pioneer in,creation of computer animated movies of hyper objects of computer generated ballet,"He was an early pioneer in the creation of stereoscopic computer - animated movies of four - dimensional hyper - objects , of a computer - generated ballet , and of computer - animated title sequences for TV and film ."
1165405,cook,calling,call,it masterwork,"Calling it a ' masterwork of pseudoscience ' , Cook warns that the influence of this book should not be underestimated ."
63485243,national socialists,came to,come to,power,since the National Socialists came to power in the spring of 1933 .
610464,control,link discoveries to,link discovery to,particularly cancer,"Horvitz 's later research continued to use "" C. elegans "" to analyze the genetic control of animal development and behavior , as well as to link discoveries in the nematode to human diseases , particularly cancer and neurodegenerative diseases such as amyotrophic lateral sclerosis ( ALS ) ."
48886233,i,’m only strong as,’m only strong as,research,And I ’m only as strong as the last research I ’ve done . ”
7732,they,have coordinate,have coordinate,their moves,"Charles and Logan are later trapped in a dimension with different laws of physics , wherein they have to coordinate their moves together and , in the process , gain a better understanding of the other 's views ."
1130,avicenna,created corpus,create corpus,commonly known as golden age,"Avicenna created an extensive corpus of works during what is commonly known as the Islamic Golden Age , in which the translations of Byzantine Greco - Roman , Persian and Indian texts were studied extensively ."
2062757,doctor,also appears in,also appear in,sarah jane 's flashback in mad woman,"The Fourth Doctor also appears in Sarah Jane 's flashback in "" The Mad Woman in the Attic "" , via footage taken from "" The Hand of Fear "" ."
62274653,wong,was sent on,be send on,promotion of rights,Wong was also sent as the Women 's Rights Representative from Singapore to the ASEAN Commission on the Promotion and Protection of the Rights of Women ( ACWC ) in Children in 2010 .
50984363,mitchell 's report writing,shown on,show on,photographs document u.s. library 1930,White placed Mitchell 's signed report on the writing shown on the photographs of the document with the U.S. Library of Congress in 1930 .
4031,fuller,was most famous for,be most famous for,his lattice shell structures,"Fuller was most famous for his lattice shell structures – geodesic domes , which have been used as parts of military radar stations , civic buildings , environmental protest camps and exhibition attractions ."
61326201,you,want,want,talk about hole explained,"“ There are various tricks you can use to associate violin sounds with what you want to talk about , ” Hole explained ."
6606318,dr. puska,had,have,significant influence on finnish health research for several decades,Dr. Puska is considered to have had a significant influence on Finnish public health research and practice for several decades .
57654268,member,member of,member of,presidium of supreme soviet,"A member of the Soviet Communist Party , she became an elected member of the Presidium of the Supreme Soviet ."
47497,doom,usurps power with,usurp power with,final incursion imminent,"With the final Incursion imminent during the "" Secret Wars "" storyline , Doom usurps the power of the Beyonders with the aid of Doctor Strange and the Molecule Man , collecting what he can of the destroyed multiverse and forming a new Battleworld consisting of different alternate realities ."
25814,he,was outspoken skeptic of,be outspoken skeptic of,idea of assemblers,"He was an outspoken skeptic of the idea of molecular assemblers , as advocated by K. Eric Drexler ."
51125777,two organizations,promote,promote,development,"After the divestment of a group of four seed companies that Sehgal founded and ran with his wife , Edda Sehgal , the couple created two nonprofit organizations to promote rural development in Suri 's country of origin : Sehgal ( Family ) Foundation in 1998 in the US , and S M Sehgal Foundation in India ."
756418,statue,was removed after,be remove after,failure of coup against government in 1991,The statue was removed after the failure of an attempted coup against the Soviet government of Mikhail Gorbachev in 1991 .
26564527,eighth doctor 's big finish audio dramas,were,be,in wake broadcast on bbc7 radio in edited form,"In the wake of the positive reaction to the revived television series in 2005 , several of the Eighth Doctor 's Big Finish audio dramas were also broadcast on BBC7 radio in an edited form ."
6042489,armen,had,have,before finance had professor,"Before entering finance , Armen had been an associate professor at the Merchant Marine Academy and a research associate at the Brookhaven National Laboratory ."
6892144,macnamara place,is also named in,be also name in,canberra suburb of chisholm,"Macnamara Place , in the Canberra suburb of Chisholm , is also named in her honour ."
2633746,encounters,was deemed,be deem,historically significant by united states library,"In December 2007 , "" Close Encounters "" was deemed "" culturally , historically , or aesthetically significant "" by the United States Library of Congress and selected for preservation in the National Film Registry ."
16559,she,is destroyed in,be destroy in,clash with original five x-men,"She is destroyed in a clash with the original five X-Men , including her younger self ."
59536305,she,served for,serve for,girls ' reform school for district,She also served on the Board for the Girls ' Reform School for District of Columbia .
7732,cable,repaired,repair,his spine,It has also been revealed that Cable has repaired his spine and is training Xavier to fight against Apocalypse .
26564527,he,regenerates into,regenerate into,war doctor,"In the 2013 live - action mini-episode "" The Night of the Doctor "" , the Eighth Doctor salutes companions Charley , C'rizz , Lucie , Tamsin and Molly before he regenerates into the War Doctor ."
4031,object,is make world work for,be make world work for,100 %,"The object of the simulation game is , in Fuller 's words , to "" make the world work , for 100 % of humanity , in the shortest possible time , through spontaneous cooperation , without ecological offense or the disadvantage of anyone "" ."
2939466,he,'d achieved,have achieve,advances,"Despite this he founded The Eternity Institute in Switzerland and all he 'd achieved — the extraordinary advances in science , medicine and technology — over the next forty years Alpert became a notorious recluse , never being seen in public and secretly harvesting DNA of the Justice League ."
59603407,he,was,be,member convened by president of united states lyndon b. johnson,He was a member of the President 's Commission on Law Enforcement and Administration of Justice convened by then - President of the United States Lyndon B. Johnson .
649928,it,was chosen as,be choose as,top book,"A popular newspaper in Taipei "" United Post "" featured "" The Great Dying "" in its weekly list of best - selling books list for more than a year , and it was chosen as a top non-fiction book of the year in August 1992 ."
70631,real discoverer,was humboldt,be humboldt,useful,"Simón Bolívar wrote that "" The real discoverer of South America was Humboldt , since his work was more useful for our people than the work of all conquerors "" ."
59329224,mcmillen,was,be,at end of her term presented to city of newcastle by nuatali nelmes on 12 october 2018,"At the end of her term , McMillen was presented with the Key to the City of Newcastle by Nuatali Nelmes , the Lord Mayor of Newcastle , on 12 October 2018 ."
863091,he,graduated from,graduate from,studies department,"In 1969 , he graduated from the Oriental Studies Department of Yerevan State University ."
25809437,dr. kenneth b. storey,is among,be among,top 2 % of cited scientists,Dr. Kenneth B. Storey is among the top 2 % of highly cited scientists in the world .
3520049,jones,appeared in,appear in,christened all funny comics,"In 1943 , Jones also appeared in the newly - christened "" All - Funny Comics "" ."
144170,ongoing series,was,be,announced,"Following the publication of the one - shot , an ongoing series titled "" The Unbelievable Gwenpool "" by the same creative team was announced , starting in April 2016 ."
7732,her,assassination of,assassination of,xavier,"Later , Exodus confronts Magneto about Joanna Cargill 's injury ( Magneto was forced to shoot a laser through her eyeball in order to prevent her attempted an assassination of Xavier ) ."
31509,three hulks,become in,become in,2000,"In 2000 , Banner and the three Hulks ( Savage Hulk , Grey Hulk , and the "" Merged Hulk "" , now considered a separate personality and referred to as the Professor ) become able to mentally interact with one another , each personality taking over the shared body as Banner began to weaken due to his suffering from Lou Gehrig 's disease ."
58615568,he,is,be,professor,He is Professor of the Graduate School and Robert S. Pepper Distinguished Professor Emeritus in the Electrical Engineering and Computer Science ( EECS ) Department at UC Berkeley .
43557941,she,completed,complete,training at yale university school in department of cell biology,"As a Fogarty International Fellow , she completed postdoctoral training at Yale University School of Medicine ( US ) in the Department of Cell Biology ."
14907770,marvin minsky,quoted from,quote from,them,"Later , Marvin Minsky quoted from them in his book "" The Society of Mind "" ."
34345920,he,was developer of,be developer of,script of behavior,"He was the developer of the script of the behavior of the opposition forces , an alternative to that which was implemented on 3 October ( "" march to the Ostankino "" ) ."
39631993,he,screened epitopes on,screen epitope on,dendritic cells,"He screened the functional antigenic epitopes on dendritic cells , and found a novel epitope of ICAM - 1 ."
26564527,doctor,faces,face,valeyard,"In the third volume , the Doctor again faces the Valeyard when his other self is recreated after he is exposed to biology - manipulating technology while using a transmat ."
24742,he,work based,work base,hamiltonian formalism,"However , from his once rejected notes he managed to work on putting quantum electrodynamics on "" logical foundations "" based on Hamiltonian formalism that he formulated ."
40670505,hyvernat 's work,was connected including,be connect include,library in monastery besides present territory of al hamuli,"Hyvernat 's work was connected with several discoveries of ancient Christian documents in Egypt in the 20th century , including the Coptic library in the monastery of St. Michael , besides the present territory of al - Hamuli in the Fayyum region of Egypt ."
2603955,joaquín,would serve as,would serve as,senator,Joaquín would also serve as senator from 1916 to 1919 .
69300830,she,was daughter to,be daughter to,mangkunegara vii of house of mangkunegara,"She was the eldest daughter to Prince Prangwedono , later Mangkunegara VII of the royal house of Mangkunegara ."
31837562,he,worked in,work in,advertising commercial production,He worked in advertising and television commercial production in the United Kingdom before emigrating to Australia in 1986 .
56423139,jones lecointe,central figure of,central figure of,black panther movement,"After the arrest and departure of Obi Egbuna in 1968 , Jones - LeCointe became a central and leading figure of the British Black Panther Movement ."
62220085,avestimehr,completed,complete,his bachelor 's degree in electrical engineering from sharif university of technology,Avestimehr completed his bachelor 's degree in electrical engineering from Sharif University of Technology in 2003 .
51554188,he,became,become,research director for air force special weapons center in relation to use of nuclear power,"Prickett was then assigned to Kirtland Air Force Base where he became the research director for the Air Force Special Weapons Center , particularly in relation to the use of nuclear power ."
17054160,geim 's achievements,include,include,discovery of method for layers of graphite known as graphene in collaboration at university of manchester,"Geim 's achievements include the discovery of a simple method for isolating single atomic layers of graphite , known as graphene , in collaboration with researchers at the University of Manchester and IMT ."
504988,conan,was in,be in,city on his quest for serpent crown,Conan the Barbarian was also in the city on his quest for the powerful Serpent Crown when he was mistaken by Scarlet Spider for a criminal .
725931,father brown,caught church for,catch church for,nearly 40 years,Terrence T. Prendergast stated that “ for nearly 40 years Father Brown caught the entire church up into the excitement and new possibilities of scriptural scholarship .
53679012,prime minister,rahimtoola,rahimtoola,foreign dignitaries,"Shamsuddin Rahimtoola was also officially gazetted as the Physician to the President , Prime Minister , foreign Dignitaries and associated persons for the period from 1978 onward ."
70631,it,plays role,play role,in attracting foreign researchers to work,It plays an important role in attracting foreign researchers to work in Germany and enabling German researchers to work abroad for a period .
33831779,family,were,be,in 2010 subject of episode of cbc news network documentary connect with mark kelley,"In 2010 , Carroll 's life , work and family were the subject of an episode of the CBC News Network documentary "" Connect with Mark Kelley "" , entitled "" Fighting Huntington 's disease "" ."
25728207,lioy,examined composition in,examine composition in,collaboration with multiple laboratories,"In collaboration with multiple laboratories , Lioy examined the composition and size distribution of the WTC dust in detail for inorganic , organic and ionic species ."
902,elements,have,have,shorter half lives,"No nuclide with an atomic number exceeding 92 ( uranium ) exists on Earth as a primordial nuclide , and heavier elements generally have shorter half - lives ."
59960843,government organization,providing,provide,training to community development organizations,"King served as vice president of the National Training Institute for Community Economic Development , a government organization providing training to community development organizations ."
2385684,he,applied for,apply for,appointment at u.s. naval research laboratory funded by nsf,"As he completed his thesis , he applied for a postdoctoral appointment at the U.S. Naval Research Laboratory funded by NSF , and spent the next 38 years of his life there ."
51065316,she,is fellow of,be fellow of,american college of surgeons,She is a Fellow of both the American College of Surgeons and the Royal College of Physicians and Surgeons of Canada .
13793,he,saying,say,herring,"He appeared in December that year on the Fox Business Network , saying "" [ t ] he CO2 scare is a red herring "" ."
49178121,texas woman,’s university is,’s university be,healthsouth hand,"Budoff currently serves as faculty the Clinical Associate Professor of Orthopaedic Surgery at the University of Texas Health Science Center at Houston Medical School , and also at the Texas Woman ’s University ( HealthSouth Hand Therapy Fellowship Program ) ."
59913199,he,was chosen in,be choose in,1968,"In 1968 , he was chosen as a corresponding member of the National Academy of Sciences ."
3038685,kavita,is known for,be know for,her contribution to philanthropy as former president of global fund for women,Kavita is best known for her contribution to feminist philanthropy as former president and CEO of the Global Fund for Women .
4788479,negroes,are going,be go,to take so much,Negroes are only going to take so much .
51910028,adverse trans boundary,mitigate,mitigate,impacts,It was recommended that modifications be made to the dam design and operating strategy to avoid or mitigate adverse trans - boundary and cumulative impacts .
26937701,he,was,be,president,He was President of the New Zealand Grasslands Association in 1955 .
67790457,he,is director of,be director of,study of health of teachers,"Since 2007 he is director and main researcher of the "" Study of the Health of Teachers "" ( in Spanish : "" Cohorte Esmaestras "" ) project , a long - term project dedicated to the study of the development of chronic diseases in female Mexican teachers ."
2784240,bruce wayne,create,create,back up personality of batman,"In "" Batman R.I.P. "" , a past hallucination induced by Professor Milo 's gas is revealed to have inspired Bruce Wayne to create the ' back - up ' personality of the Batman of Zur - En - Arrh , a more ruthless Batman personality designed to take over in the event of Bruce Wayne being psychologically attacked in such a manner as to render Batman out of action ."
66664199,he,graduated with,graduate with,engineering degree,"In the fall of 1928 , after seven months of required practical work at a steel plant in Krefeld , he entered the Technische Universität Darmstadt , where he graduated in 1935 with a engineering degree ."
55523533,lady evelyn,attended,attend,opening in 1972 including treasures at british museum,"Lady Evelyn attended the opening of the Tutankhamun 50th anniversary celebrations in 1972 , including the Treasures of Tutankhamun exhibition at the British Museum , London , where she was presented to the Queen who was there to open the exhibition ."
104998,he,performing,perform,after published of him launching into expletive laced tirade after earlier interruptions,He incited media furor while performing at the Laugh Factory comedy club in late 2006 after a cell phone video was published of him launching into an expletive - laced racist tirade after earlier interruptions from a group of late - arriving audience members .
25809437,additional applications,include,include,insights in metabolic syndrome,"Additional applications include insights into hyperglycemia in metabolic syndrome and diabetes , and anoxic and ischemic damage caused by heart attack and stroke ."
18974154,fbi,released,release,collection of emails written,"On August 6 , 2008 , the FBI released a collection of emails written by Ivins ."
58755477,she,was,be,appointed,and she was appointed as a Privatdozent at the University of Bern .
1130,he,was instead adherent,be instead adherent,followed by samanids,"He was instead an adherent of the Hanafi school , which was also followed by the Samanids ."
18588727,he,was originally called,be originally call,mr. zero,"He was originally called Mr. Zero in the comics , but the producers of the 1960s "" Batman "" television series renamed him Mr. Freeze and portrayed Batman addressing him as "" Dr. Art Schivel "" , and the name quickly carried over to the comic books ."
29688374,galileo 's discovery,was,be,thus his contribution to two stage transition to full heliocentrism via geo heliocentrism,Galileo 's discovery of the phases of Venus was thus his most empirically practically influential contribution to the two - stage transition from full geocentrism to full heliocentrism via geo - heliocentrism .
53195613,eastman,expressed,express,concern,In 2013 Eastman expressed concern that IDD may be affecting Australian children 's ability to perform at school and reiterated that view in 2016 .
9506,jennerian,ceased,cease,operations,The Jennerian ceased operations in 1809 .
62621548,joshua ogunwole,was,be,in 2021 recognised as fellow of soil science society in her 45th annual conference held,"In 2021 Joshua Ogunwole was recognised as a fellow of Soil science society of Nigeria in her 45th Annual conference held at Bowen University , Iwo Osun State Projects ."
20942188,praise,noted,note,episode,""" Capaldi received overwhelming praise for his performance in "" The Doctor Falls "" with Patrick Mulkern noted the episode as a story dedicated to the character and how he "" stands tall "" , along with Daniel Jackson of the "" Daily Mirror "" highlighting the twelfth Doctor , praising how he "" simply shines "" ."
1788497,limited resolution,was,be,one effects fogging effect of electrons,One of the deleterious effects that limited resolution was the fogging effect of the electrons backscattered from the bulk of the sample .
